subreddit,title
1,What is lying about feelings to get consent? Is it sexual manipulation?
1,How can you be physically attracted to a man who is not conventionally attractive?
1,Who else is thinking about leaving the US?
1,How to respond to “I’m not into you”
1,"Ladies, how do you get over a man you can’t have?"
1,"Ladies, How many of you are into vintage fashion that are from the 1940s and 50s?"
1,How do you effectively communicate with your partner when something that they did/said bothered you?
1,What is a question you've wanted to ask about having sex while pregnant?
1,How do I know if a girl likes me back
1,Older student who is looking for some dating-related advice
1,When did you realize you have a personality disorder? How do you manage?
1,Have you ever had a friendship that ended but later reconciled and on better terms? Why did it end in the first place?
1,Has anyone been genuinely undecided about having kids? How did you ultimately make a decision?
1,"For those of you who work in some form of customer service (restaurants, retail, etc.), what is your worst customer experience?"
1,How do you feel about men in tank tops?
1,How is it that I attract more women when I feel that I dont need to have a girlfriend ?
1,Ladies should you always tell someone how you feel about them even if you know they don’t feel the same about you?
1,At what point do you guys call it crossing the line as just friends to more than friends.
1,What are your copper IUD experiences?
1,"Who is absolutely not your type, but oddly tempting?"
1,What are your Copper IUD Experiences
1,What did your last relationship teach you?
1,How do I not come off as an asshole?
1,"Would you date a guy with a smartphone? If not, why?"
1,Ladies should you always tell someone how you feel about them even if you know they don’t feel the same about you
1,Who’s your “It’s not like this with other people “?
1,Is emotional stability in men preferable to complete transparency? What are your thoughts on this comment posted in r/AskMen?
1,Single dad. No spouse. How do I talk to my 9 year old daughter about her recent rapid weight gain?
1,Why are so many girls and women obsessed with K-pop groups?
1,Do women care about hair loss in men especially when it is younger ages like 20?
1,I'm interviewing at a local public library for a front desk job. I am at a loss for what to wear... Is there such a thing as too dressy??
1,what were ur symptoms with fosfomycin for uti
1,How do you cope with being a woman?
1,What advice do you have for moving on from friendships you lost but thought you’d have forever?
1,"The oft cited cliche is that women find men to be emotionally distant or closed off. However, some men have found that when they are truly open and vulnerable in a relationship women respond poorly. Do you place greater value on emotional stability or vulnerability in a partner?"
1,How does the lack of a father figure growing up affects you?
1,What is your coping mechanism for everyday stress?
1,How/What should I do to become more comfortable with my body?
1,What is your favorite Beatles Love Song. The one that makes you think Wow and think about your S.O. Mine is Something.
1,"How to be a better man, please help"
1,When on a dating app what are your red and green flags
1,"If a genie offered you the chance to become twice as strong as your SO, would you take it (assuming you are not already)? Your appearance would not change but your SO would know what you'd done. How do you think your SO would react?"
1,What are some open assumptions you made of a someone that led to a wonderful conversation?
1,(f/21) How to learn to use tampons?
1,Why am i having this Obsessive thought
1,What's your first reaction if your date has nerf guns in his bedroom?
1,HELPP!! What do you look for on dating profiles??
1,Who else can go the entire day without picking up their phone because they have no motivation to text people? Is it just me?
1,"Women with people-pleasing tendencies, how did you get over them without losing who you are?"
1,HELPP!!! what do you look for on a dating profile
1,HELP!! what are things you look for on dating apps profile ??
1,"Ladies, when is it ghosting?"
1,Which trait of yours is your most treasured superpower?
1,"Women who dated guys with below average equipment, how did that go?"
1,What are those pyjamas that are like onesie but they are button up and are like shorts at the bottom called
1,What advice would you give someone who is very lost in late 20s?
1,"Do you ever subtly show ethnic background or other cultural traits by wearing small in-group indicators? If yes, what are they?"
1,Do women actually enjoy facials because it does nothing to please them so if it does how ?
1,Have you ever moved and/or left a partner for a job? How was that for you?
1,What's the ideal body type/physique in a mate and why?
1,How true/accurate do you think the “You are who you attract” saying is in the dating sense?
1,How much do you playfully tease a man when you are into him romantically? Would you say this is a big sign of interest?
1,Who else considers this racist or am I overthinking it?
1,What to do about getting a boner while hugging my girlfriend
1,Is it ok when boys are shy?
1,What are some street smarts that you should know?
1,Should men shave or trim their pubes and why?
1,how can I achieve a quick post baby glow up
1,Is there a difference in the tonality of a greeting when a woman is interested in a certain man?
1,Does woman greet a man with different tonality when they are interested in him?
1,Any suggestions as to where to shop?
1,I’m stuck and need advice I don’t know what to do
1,The current partner of my short term ex follows me on social media. Why might they do this?
1,Why are woman sooo confusing?
1,Have you ever moved and/or left a partner for a job? What was it like for you?
1,Where are all the low quality women?
1,What can you tell me about myself and can you answer some questions for please? I'm transitioning MtF
1,What can you tell me about myself and can you answer some questions for me please. I am transitioning. Thank you &lt;3
1,How do you secure your hair?
1,What are your thoughts on men who mostly date foreign-born women?
1,What do women want ? Seriously?
1,How do you break up with a guy gracefully?
1,Do most women view men who are virgins as “undesirable” or “low value”?
1,What would be your reaction if you caught your significant other masturbating?
1,"How should I take it that my wife caught me masturbating, asked me what I was doing, and then walked out of the room? Am I wrong for thinking that she doesn't find me attractive anymore?"
1,What should my coworkers and I do about the comments made by our manager?
1,What is your hobby your mom doesnt understand?
1,Do women view men who are virgins as “undesirable” or “low value”?
1,23[F4F]: Looking for kinky and dirty active females who are active into reddit group chat. Are you up for those kinks? Hit me up to get added.
1,23[F4F]: Looking for kinky and nasty females who like to be active on reddit group chat. Hit me up to get added
1,How did you meet some of your closest friends?
1,"Women of reddit, what's your toxic trait?"
1,What do women think about hair loss in men?
1,How Will this get my girl pregnant
1,"If you have a spare $2000 to spend on your first luxury bag, which bag would it be?"
1,"What is your ""Why am I like this?!"" issue?"
1,How is it possible to have a healthy friendship with women?
1,Ok this is a serious question about my girlfriend and our sex life that’s been bothering me for some time now why she feels a certain way
1,Why am I getting paranoid? Am I pregnant? Help.
1,Why are you happy to be a woman?
1,what are the reasons why you would want to become a man?
1,This topic leaves me scratching my head when it comes up
1,Who has combined hormonal birth control?
1,Which comfortable Dress shoes do you recommend?
1,I'm in a Gym songs' hunt. What are your suggestions?
1,Who else feels like their love life is cursed?
1,How do you deal with comments about your body?
1,How can I grind on it without hurting him
1,how do you tell your ex they gave you a STI?
1,"Women of Reddit, why do you bite/slap (playfully) your SO?"
1,how to draw fashion dress illustration #fashion #dressdesign #fashion
1,How to track period and ovulation?
1,How should I approach this situation with a girl I met in college
1,How to track period and ovulation
1,How do I ask my gf her shirt size
1,Ladies whats/who the perfect husb_and material ?
1,How many girls have sex because they’re scared to say no?
1,How should I approach this situation with a girl I met a college)
1,How do I pick? “Meh” fully remote job or dream job with hybrid schedule
1,Trans Athletes Inclusion / Exclusion Discourse: What's Your Take?
1,When or would you want to know if a guy you were seeing/dating was a virgin?
1,"Ladies, What style of heels do you like wearing? Would you wear them everyday?"
1,Tampon strings… where does it go?
1,"I'm 18 and i need advice, who can help?"
1,"Childless women, what is your plan for old age?"
1,How does a man become viewed as a viable sexual partner?
1,How do I stop viewing women as sexual objects (Not satire)
1,"Do you girls ever feel disturbed by your bf watching girl’s nudes? If no, how do y’all not disturbed?"
1,How to move on from a rejection I faced from a girl I love?
1,"For a new relationship that you are invested in, how patient are you willing to be with sex difficulties?"
1,What dose Casual dating mean to women?
1,"What dose ""casual dating"" mean to women"
1,"What dose ""casual dating"" mean to you"
1,"what does it mean when someone is only interested in ""casual dating"""
1,Single women of Reddit. How much do you miss cuddling/ holding a partner?
1,Do women really not look at the faucet when they are showering?
1,What is something shady that your significant other does?
1,Women what do you all wear under yoga pants/tights at the gym?
1,"If you ever walked out if a job, What reason?"
1,What’s the reason people (women specifically) cheat and then claim they still love the person they cheated on?
1,What are some things women should do for each other?
1,"My Penpal (26M) want to block me because of his girlfriend,why?"
1,How do I lower my standards as a perfectionist?
1,How many of you would consider 7.6 inches and big/ good size
1,Have you ever had a Eureka Moment while journaling your thoughts? What was it &amp; how it make you feel? Was it helpful or did it make things even worse?💡
1,"What is something that you initially didn't want to tolerate, but eventually decided that you had to accept because it was too common?"
1,How would you feel if a guy was masturbating next to you while you’re asleep?
1,How do you cope with loneliness?
1,What’s the most unusual thing you’ve seen while driving ?
1,"How do you subtly imply that you are not and will never be romantically interested in a new friend that you think might like you, without losing that friendship? I love hanging out with him but recently he used the word ""date"" instead of ""hang out"" so I'm kinda worried...."
1,who's experienced tension their relationship because of a pet?
1,OFFICE QUESTION - How should I consider my co-worker behavior?
1,Office question - How should consider my co-worker behavior?
1,Would you want to know if a guy you were seeing/dating was a virgin and when would you want him to tell you?
1,How to move on from a relationship of 5+ years?
1,What would you do if you suspected a friend of 20+ years was giving you the slow fade ?
1,How should I 25M tell the girl 25F I’m dating that I was a virgin before meeting her?
1,"I think my best friend's girlfriend likes me, what should I do?"
1,what kind of looks do you prefer?
1,How to communicate to your male boss that you need a day off for period cramps?
1,How should I feel when I (F21) an NBSB is date a younger guy (M18)?
1,When was the last time you were happiest? How did it happen?
1,"So I recently opened up to my GF about how I felt she was less interested in having sex with me at times and she finally admitted it’s probably a side effect of the pill, which she’s been taking the entire time we’ve been together. Has this ever happened to you guys or was it just an excuse?"
1,What gives you life meaning and purpose right now?
1,How to move on from a relationship of 5 years?
1,"How do you feel about the term ""guys"" as a gender-neutral term in work settings?"
1,What am I supposed to do to be emotionally available again?
1,"How do you consider the term ""guys"" as an appropriate gender-neutral term in work settings?"
1,"How do I navigate tension with my fiance's best friend, who I am convinced just doesn't like me? We have been together for almost three years, and she intentionally sought to make me feel uncomfortable and out of place before even meeting me. Starting with me being bisexual, and her being queer..."
1,How to get fiancée to initiate sex more?
1,What’s your favorite brand of period underwear?
1,How can I fix the dark circles under my eyes that’s NOT make-up?
1,Who goes through the same rollercoaster of discouragement with dating apps?
1,"Aside from shoes and cars, what other material items do you look at to gain an impression about someone you meet for the first time?"
1,Did you ever regret ending a short relationship [5months or less] which was only but good?
1,Did you ever regret ending a short relationship [5 months or less] which was only but good?
1,"Do women really like foreplay and roleplay?mean no offence just wants to know...what you like ,what not...."
1,What are the cramps I get before my period?
1,What made you realise your partner is a narcissist?
1,"If you were offered the kind of physique that would let you win Ms. Olympia, would you accept? Why or why not?"
1,What matters more. Income or quality time together
1,How can I delay or bring forward my period?
1,How to approach in public ((do/don’t?))
1,What are things you never tell your partner which could hurt them? (Unintentionally )
1,Add Snapchat jessikasexy1 why
1,How and when did you tell your parents you don't want to ever have kids?
1,"Women of reddit, be honest, would you leave your partner if tomorrow you won a ridiculous sum of money and why?"
1,Anyone who had a LEEP procedure young
1,How do you trust someone that has lied and cheated on you
1,How did you stop going back to a abusive man
1,What’s a song that encapsulates female rage for you?
1,What would you add to the Bechdel Test to raise the bar a little bit?
1,Why do random men keep stopping me on my walk home from work?
1,What are everyday sexist and gross phrases that need to be retired?
1,Why is it so hard for women to decide where to eat at? It's inappropriate to call all women indecisive but it's a problem a lot of men have with y'all.
1,Why am I like this? I always obsess with someone
1,How to wear clothes that require no bra when you have a large chest?
1,If you have ever been pulled over how did you deal/cope with the aftermath ?
1,How likely are you to crotch watch?
1,How do I make a girl I told I had a crush on to stop trying to make me feel better because it just makes things worse (without being offensive)?
1,How do I get out of friend’s events for their kids?
1,Would you ever date a mamas boy why or why not?
1,Looking a Girl who is ready for Casual hookups...
1,What is the key for a calm and peaceful pregnancy?
1,why is my (F22) birth control pill making me CRY so much
1,"Above average looking women in their 20s, what is your dating life like?"
1,Am I being naive? Is he a creep? How to handle this situation?
1,Have you ever been blindsided by a partner during a breakup? How did you get over it?
1,How to remove pad from underwear silently?
1,Do men try ? Cause it sounds like they don’t from what I hear
1,"What would you do if no one brought presents to your expensive, catered, 40th birthday party?"
1,"What is one thing you felt you were not ready for in life,but when it happened you managed it well?"
1,What clears up acne fast (men's skin) oily
1,How come he wants to smoke weed but doesn't want a woman who does ?
1,How do you wear your Birkenstocks?
1,What is everyone’s experience with the mini pill ?
1,How would you go about your relationship if your partner was perfect but did not fulfill your sexual needs?
1,What size one piece lingerie is best for me?
1,"The Long Line, when needing to go?"
1,What would you do if you found out you weren't compatible?
1,What would you do if you found out you weren’t compatible
1,Why are some women like this?
1,"21F asking what to do, wants to contact childhood crush (22M) &amp; have sex with him"
1,how on earth do i get over him.
1,How would you feel if your SO told you every friend/family of theirs they introduced you to believed your SO was waisting time and could do much better?
1,What are some things you take with you on holiday if you know you will be on your period?
1,Why do I have lower right abdominal pain? (19 year old female)
1,How do you navigate clothing and personal style without breaking the bank or buying fast fashion?
1,Why do I have lower Right Abdominal Pain suddenly that’s lasting? (19yr old Female)
1,What can I do with this situation?
1,What is the best perfume to gift a guy who works in tech company?
1,How do you/would you feel being called by your male partner’s last name when you’re not married and have no plans to marry?
1,Why should I stay with my bf?
1,WHERE TO GET HUMAN INTERACTION
1,Why do you lack the desire to be in a relationship?
1,How to deal with a partner that mocks my weight and eating habits?
1,What would you think if your SO bought you your first vibrator as a gift
1,How to deal w a partner that mocks my weight
1,"20 M, bladder Cancer survivor who is looking for wide women incontinence pads"
1,who else does this or am i the only one😭
1,How Do I get my Girlfriend to fully expose her sexuality to me?
1,"I (F23) had sex and he didn’t wear a condom, what now?"
1,"Ladies, anatomically speaking, (i.e. height, facial hair, muscle, etc..) —What physical male feature are you glad you don’t have?"
1,"How to maintenance the relationship with MIL, my relationship with my MIL is very delicate."
1,"""What are women of reddit, views on an online friend?"""
1,"Ladies, if you didn’t like your SO at the beginning, what did they do to change your mind?"
1,"Ladies, if you ended up with your SO but didn’t like him at first, what made you change your mind?"
1,"People who'd be considered young adults(19-25ig?), do you feel like that age?"
1,"To those who didn’t like their SO but somehow ended up with them, what did they do to change your mind?"
1,"Do you think a woman isn't emotionally mature when she wants a child, but thinks the post-pregnancy body looks ugly?"
1,What can I do to get rid of BV?
1,"What one skill, had you acquired it before turning 17, would have totally changed your life?"
1,What are some good quality for fair pricing online clothing websites/shops?
1,Why would an older woman need feminine pads?
1,Genuine question how many women feel safe walking at night alone in America?
1,What books/ do you recommend?
1,"biological females, who has a 6th sense for when your period starts or is about to?"
1,PLEASE HELP! What can I do to not smell down there?!?
1,"I wanted to ask this question from my female friends. Is it sexist to think that after marriage it is my duty to protect my wife and make her financial needs. And if my women wants to work, in whatever fields she wants. I encourage her to do it. I was curious to know. If it is sexist than why?"
1,PLEASE HELP!!! What can I do to not smell down there
1,What do I do about my wife of 7 years who is disrespectful and probably cheating on me.
1,"Women who take birth control as a contraceptive, do you split the cost with your partner?"
1,"M 23, F19 does she actually like me? Or am I being paranoid and not reading the signs correctly? How do I know for sure?"
1,What are your top 3 reasons for remaining Childfree?
1,"Women who take birth control pills as a contraceptive, do you split the cost with your partner?"
1,How many women have actually experienced a threesome. And do y’all even find it enjoyable
1,What was your angriest moment?
1,"What do I do? My partner [F/27] is showing strong signs of Dementia, what are my immediate options to get her seen (located in NYC and she has Medicaid)?"
1,"Help!!! What do I do, my partner [F/27] is showing strong signs of Dementia, what are my immediate options (located in NYC and she has Medicaid). I will even try to pay out of pocket. Whatever it takes."
1,How to get pegged For the first time
1,In your opinion what are the Differences between him being a gentleman a simp and an asshole
1,Have you ever been to a lesbian bar? How was it? Do you recommend it for F22?
1,Have you ever been to lesbian bar? If so how did it go? Do you recommend it?
1,Who here has tried the Youth to the People Superfood Cleanser?
1,Why would my wife of 25 years about 2 years ago develop a fetish for her nipples?
1,What hair dye do you use to do your own hair at home?
1,DIY hair dye…What do y’all use?
1,"when you’re on your period, how do you avoid leaking when getting out of the shower?"
1,How often do you wear G-strings or thongs at the beach?
1,How Should I Financially Compensate Ex?
1,Someone who has sucked dix
1,"Do attractive women stare at people, specifically males, no matter how good looking they are or not, just for attention or do they just have a staring problem?"
1,What are some first date ideas to take out a girl I met on tinder?
1,What are some first date ideas to take out a girl I met on tinder
1,Has your SO ever followed your ex on social media? Have you ever followed their ex? Why?
1,How - Financially Compensating Ex?
1,How do you feel about your partner watching porn?
1,What are your usual pms food cravings?
1,Why is it ok for people to think you should never have a bad. Especially when they seem to have one all the time
1,"What happens If a boy kicks a girl in the vagina, can his foot get stuck?"
1,Has anyone ever heard of a man who has said he was sexually assaulted by a woman or a man to cover up for cheating on his partner?
1,"Mostly monogamous women, when did you start to get bored in your relationship and tips to combat it?"
1,Who has gotten their nipples pierced? One a scale of 1-10 how bad is the pain ? 10 being childbirth 😂
1,I (F18) and my bf (M18) might have done a mistake. What could I do???
1,What style/brand of bra do you recommend?
1,"When I cook with onions, my vagina starts smelling like onions too. Does this happen to you?"
1,I think my best friend (22F) has a crush on me (24F) which makes me uncomfortable
1,How often do you clean your earrings?
1,"Mums, How would you feel if your adult child suicide?"
1,What should I do when my spouse no longer interested in sex after 5 years together?
1,What would be the maximum amount of time you’d not talk to your partner after a disagreement?
1,"What/ Ladies, list a few things your man does to annoy you?"
1,What is something a man said to you that showed you they needed to grow up or that changed how you viewed the relationship?
1,"Women who live alone, how do you fight of the loneliness?"
1,"Women, how did your SO change after giving birth? If so, was it in a good way or a bad way?"
1,Question- why as a spouse am I responsible to make friends for my spouse so they have someone to talk to or hang out with?
1,Is it weird if your BF is bringing another girl’s bag with you knowing? What to do? Should I confront him about it?
1,When do you decide there’s no chemistry and move on? Are 3 dates enough?
1,Dating/relationship help. How to be a better partner?
1,"""How"" a lil project of mine?"
1,"""How"" a lil project of mine"
1,"Could you be in a relationship with someone who meets your every desire, but you're not physically attracted to them?"
1,Do You Think He is Someone Who is Still Interested?
1,How can I work out if my friends at work are in an open relationship?
1,QUESTION: In your opinion what is the most flattering shirt and color a man should wear?
1,Women what is the most flattering shirt and color a man should wear?
1,What do you girls think we think when we know we're not that handsome?
1,Hey! My gf and me had a mistake and she had to take plan B. She’s currently 6 days late. How late were you when taking plan B?
1,"Women of reddit, Why is it so hard to have dignity and self respect nowadays?"
1,"Women of Reddit would you rather be in a relationship with a man that is kind, empathetic and emotionally intelligent or a Red pill or alpha male type of man ? And why ?"
1,How do I change careers and get out of customer service positions
1,"How is my body, can anyone rate it"
1,How important is size to you when making love?
1,Is he narcissistic or why am I crazy?
1,Itching when growing out pubic hair...?
1,"Women in male dominated fields, what was the most Triumphant Moment while asserting yourself at work?"
1,How is it really like for those of us that make more than our male partners?
1,When is an appropriate age for a daughter or son to quit showering with a parent
1,Why does my (26M) girlfriend (27F) talk to her ex after cheating on him years later?
1,How do I ask my mum friend to stop sending me nudes of her 4 month old baby?
1,"What woman&amp; man singers would make a great duo,like Elton John &amp; Rhianna?"
1,How as an abortion either brought you and your partner closer together or pushed you apart?
1,"This girl at my school has talked to me on a few occasions, but I don’t know if she likes me or not, she’s friendly when we talk and tried to help me get a job, but I just don’t know, any thoughts/advice?(we are both seniors in high school btw)"
1,What is ladies consensus on adding others to the mix?
1,Asian guy! How do you see them
