subreddit,title
0,Have you ever stood up for a woman at your workplace being treated unfairly?
0,How have you had to handle a partner who couldn't control her child?
0,Request?
0,Would you ever ask a woman if she was with you for “you” or what she felt you could provide?
0,does my guy friend still have feelings for me?
0,guy friend has had new gf for almost a year and never brings her up in conversation
0,Enterprise car rental
0,What can be broken but never held?
0,How did you move over with wanting someone who didn’t want to be in your life ?
0,Someone Explain
0,What would be the best birthday gift from your significant other?
0,How would you react if your S/O asked for money or wanted you to buy them something just because you bought something for yourself?
0,"If you’re in a wedding party, would you rather spend $150 to rent a tux or $300 to buy a suit?"
0,If a woman gives bad head would you continue to hookup with her?
0,"Men , if a woman you hooking up with, give bad oral sex would you continue to hookup?"
0,Would you move back in with your parents?
0,"Men , would you continue to hookup with a woman if she gave bad oral ?"
0,"How would you feel if someone called you a ""twink""?"
0,What do you like about yourself?
0,How many of you own a can of WD-40?
0,Can you lose the fat pad around your thing?
0,My friends poke fun at me. Am I just being sensitive?
0,Honest question for the straight guys...
0,How do you politely ask a guy to eat your pussy?
0,"Men of Reddit, in an ideal world, how ticklish would you like your partner to be?"
0,What is your favorite car?
0,What are some ways you invest in yourself to become the best version of yourself?
0,What’s your love language?
0,Would you let your partner look through your phone?
0,Feelings for a coworker. Any tips on how to stop it?
0,Need help making a move ( 22 M)
0,Back to the basics
0,"Men, how many years younger would you go in age in terms of dating and why?"
0,How do you manage to be the strongest person at your father's funeral?
0,My 9-month long partner (30M) has suddenly gone silent on me (23F) after we both moved towns for work. Why?
0,How do you feel when she has extra hair down there?
0,"G'day fellas, what advice can you give someone whose male partner has asked her to come to the strippers with him and his mates?"
0,How do you prefer to be rejected?
0,"Not introvert, not talkative, not attractive, any help?"
0,"Hey men, what’s with dudes calling me (30F) by my last name my entire life?"
0,"Men, do you ever get jealous or competitive within men friends group, what are the reasons?"
0,"Avoidant men that struggle with depression, what is the best way a partner can help you during the tough times?"
0,Banda ayuda busco una película
0,Looking at stomachs
0,Anyone else think women in their 30's are peak?
0,In what ways does homophobia negatively affect straight men?
0,What do you think of the girl who makes the first move?
0,How did you deal with your cheating girlfriend?
0,"Once you find someone attractive, do you always find that person attractive?"
0,"Men 40+, have you experienced any changes in sexual satisfaction and performance as you have gotten older and what can your partner do to be supportive?"
0,I feel like sex and relationships are an exclusive club that I can’t get access to. How do I fix this mindset?
0,Sugar baby needed Urgently
0,What’s your unpopular music opinion?
0,"Fellow GirlDads, what's something new you've learned from your daughter that you never learned from either your son or your own childhood as a boy?"
0,Why would my friend want to keep me in his maid's room when I come over?
0,How come drinking cold water doesn’t bloat me like room temperature water?
0,"What’s sexy for a woman to do, but creepy for a guy to do?"
0,Should I be suspicious?
0,Is it normal to not want a relationship?
0,What's the most cringe moment you've witnessed from a IRL manic pixie dream girl?
0,Should I leave her?
0,My (23m) girlfriend (19f) is pregnant and wants to keep it
0,"Men, do you think Taylor Swift is sexy?"
0,Should i leave her?
0,What is your story about the one that got away?
0,I’m an almost 29 year old single woman who is dating. Will grey/white hairs on my temples be an issue?
0,Hey fellow men. Tell your “one that got away” story?
0,the lens changes after infidelity
0,"If you could go back in time and learn something you wish you know today, what would it be?"
0,Advice on what to get my male friend for his birthday (17)
0,What's more attractive?
0,How old are you and have you ever been anybody’s best man?
0,"I know a little bit of everything and a whole lot of nothing, so ask away, and I'll give honest safe advice."
0,"Men of societal status (doctors, lawyers, CEOs etc) do you use dating apps?"
0,Why don’t men compliment each other a much as women do?
0,Does my coworker like me or is he just being friendly?
0,"(Serious) I'm asking for help, internet. How do I politely tell my new boyfriend to take better care of himself? It's a little embarrassing of the state he keeps himself in and he is apathetic about it."
0,Is it weird to listen to ASMR women on YouTube?
0,How can I be supportive of my boyfriend who has ED/performance anxiety?
0,Fantasy
0,"How do men feel about a woman who is active, attractive, stays fit and takes good care of herself, but just is just naturally curvier and has some meat? I see a lot about the ideal hourglass or the volleyball bodies, and I'm just not built that way, and so what about those of us who are in-between?"
0,How long until you give up on a crush?
0,Why would they wink?
0,Do you mind if your partner is sexually unexperienced?
0,What is something your dad has said to you that you will always remember?
0,Whats a secret that youve kept from your partner that could end your relationship?
0,Have you ever had a crush on your barista?
0,Have you ever gone to a girls work every day
0,"How do you do it 'all' with a busy life of priorities, social life, etc?"
0,Are the owners of the cars destroyed in the garage collapse in NYC covered by insurance?
0,What can be done here?
0,What would you do if you heard your girlfriend's whole family making fun of you?
0,What is a woman ?
0,"New girl in office, what should i do?"
0,the smallest things will make me horny and I hate it
0,"Happily lonely men, how are you enjoying being single and alone?"
0,"my girlfriend &amp; I just broke up, suspectingly she could have bordeline personality disorder which makes our relationship difficult. She's a nice &amp; simple person but when the anger hits it sabotages everything. As a man, should I be better on my own now or at least do something about it"
0,"How do I say ""no"" to my parents?"
0,Why are some men not into kissing when hooking up
0,How do you get back to dating after a painful breakup?
0,Do some guys not like kissing during sex ?
0,Thoughts on Bollywood movies and why?
0,Do men care about very muscular women?
0,"My(23M) gf’s(26F) dad was diagnosed with cancer, is it crazy if I leave everything to be with her at worst case scenario?"
0,Do men care about women having muscles?
0,"Men from Single Parent Childhoods, How do you think their absence has affected you?"
0,How did you find your favorite band and or genre of Music?
0,What is in your bucket list?
0,I think I Got taken advantage of by a girl I went on a first date with
0,Thoughts on human barbecue and why?
0,What can you say during sex but also at a family dinner?
0,What's something a father should teach their son?
0,Do straight guys understand that banning abortion makes it harder for them to have casual sex?
0,Newly single… help!
0,Advise
0,"What's the ""disrespect"" that you won't take ?"
0,Я- сын миллионеров. Задавайте вопросы.
0,Should I (31m) find and tell the boyfriend of a girl(27f) I hooked up with after meeting at the bar that she chested on him?
0,Have you had a relationship end due to communication issues that you felt were fixable?
0,"When I come over, why would my friend want to take me to his maid room in his house?"
0,Mixed signal mess 😏 please help
0,"what is the elusive ""feeling"" you search for, for love?"
0,Not sure what to think
0,Am I dating a weirdo?
0,"""1 in 3 men are virgins or haven't had sex in the past year"" just wanna see how true this is."
0,What do I do about this?
0,If he really likes me will he not text?
0,former addicts/substance abusers what made you change your life?
0,Is it normal that my boyfriend likes to fondle my skin tags?
0,Does this make sense?
0,"Men, what are the signs that you show when you fall in love with your coworker?"
0,Why would my friend want to take me to the maid room in his house when I come over to visit?
0,What does he think of me? Are we friends or more?
0,Do You want to SEE more?
0,How to stop my self thinking that my girlfriend isn't good enough
0,What do you think about straight men who wear pink clothing with long hair?
0,"If somebody you asked out said she’s not ready for a relationship and asks you to wait for her, how would you react?"
0,"Cp mega Dropbox link is all available with over 6644+video which includes mom &amp; son, deep cp fuck, black cp, dad &amp; daughter, cp teen group chat full 780+girl &amp;boy available too add me on telegram if you are interested to get it ask for price @Falconsell56"
0,What’s something a woman does that brings out your protective side?
0,Do you still cringe at embarrassing moments from your teen years?
0,NEED IDEAS. What are some good tortures for a “wheel of torture” at a bachelor party?
0,Self Promotion
0,Do you regret not having kids?
0,How normal is licking a woman’s butthole during sex?
0,When to disclose ED to a new partner
0,When to disclose ED to a new partner?
0,"Older guys without kids, do you regret not having them?"
0,Are you in support of abortion? Why?
0,Ignoring dating
0,How do you get a chip off your shoulder?
0,Receiving head from your partner
0,Do I confront my spouse?
0,Do I just move on?
0,Confused and hurt
0,"My roomate was talking with a girl that goes to my school and is closer to my age (Im 20 and in college, he's 24). Then decided he isnt into her and is giving up, is it weird to ask him to set me up with her?"
0,What do you think of when Trying to get Soft
0,"Why do some men (Mgtow types) exclusively seek out virgin women for relationships or marriage, even if they themselves have a history of multiple sexual partners?"
0,My potential partner moved abroad and now we're no longer even friends
0,What's the most f*cked up rumor people spread about you? And how did you deal with it?
0,Is 24 too old for a woman to find a job in comp sci pls help
0,"Owners of tiny dogs, what do you love most about them?"
0,What should I buy him?
0,ZaraLynn
0,"Owners of tiny dogs, what do you love most of them?"
0,anyone know how to get your room to smell fresh
0,Help me better myself please
0,What You guys know about Nerilex anti hair loss shampoo?
0,What are your sweet revenge stories?
0,"To the gentlemen who lost attraction to a SO you still loved very much, what are some ways you rebuilt that attraction?"
0,Why do you guys mention you are married too often in a casual conversation ?
0,Does your wife or girlfriend know your reddit account?
0,Why is Reddit so Anti-Man
0,How long did it take and how did you get over an ex of multiple years?
0,"Besides liking girls, what do you have in common with lesbians?"
0,I don't know how to deal with this situation. I hope you guys can me some advice.
0,How to stop sweating so much during summer other than taking so many showers a day and changing clothes multiple times a day despite using deodorant?
0,"Which qualities separate a friend from a girlfriend, and a girlfriend from a wife?"
0,How to make the most out of events/celebrations?
0,What did your last heart break teach you?
0,"Men, need your advice"
0,"Men, your advice is needed."
0,Do you look for different qualities in women you'd like to hook up with rather than date?
0,What’s one thing about other men that annoy you?
0,What are some good strategies you guys work on to quit porn and Masturbation?
0,Not sure if any other men struggle with this?
0,Need some advice/opinions on my future living situation. What would you do?
0,Viagra &amp; Ecstasy
0,"Hi, I'm 20yrs, female, 170cm and 95kgs. I've always considered myself skinny but recently at the doctor's I was told I was in the 'overweight' range. Can I get a guys perspective whether you would consider me fat? And should I lose weight?"
0,IF some one give $1000 to start a Business what Business would you start and why
0,How was your first experience in giving a blowjob?
0,Is it normal not to be honry anymore?
0,What would you consider to be a major rite of passage that most biological boys go through that signals the start of their transition into manhood?
0,Why do women of a different culture biologically age at a different rate?
0,How is your relationship with your mother?
0,Need some advise/opinions on my future living situation
0,What are your icks about women?
0,What is the BIGGEST red flag in women?
0,"If you were arrested with no explanation, what would your family assume you had done?"
0,"What do you fellow men prefer most? Blondes, brunettes or redheads?"
0,Who is your favorite TV dad?
0,am i a coward for not defending/protecting a women i dont know?
0,Is my girlfriend a red flag for doing this
0,How does it feel to be considered a sexy men by many women? Do you leverage such privilege in some non obvious ways?
0,What kind of car are you?
0,Bringing a girl over? Where to cuddle? 20M 19F
0,Question about my gf
0,How do men feel about “rich” women?
0,Have you ever experienced sexual abuse within a relationship?
0,How do women feel about guys with pet rabbits?
0,Do the rest of you like those terrible fake tans girls put on or when they put on allot of makeup?
0,What is (was) your list of absolute must haves in your spouse?
0,How do you define an Influencer?
0,"""An influencer isn't someone with views but someone who changes people to become better human beings""...How do you interpret this statement?"
0,"What would you do if you lost your job, your friends, your spouse, and your family turned against you?"
0,"Men, how did your buddy change after getting in a relationship/getting married?"
0,How do you deal with the fear of ending up alone with no love and no close friends?
0,I have a question
0,Is it possible to repair old iron fences instead of replacing them?
0,What's the reason...
0,How a girlfriend reacts
0,Career change to make money (advice)
0,Why do breakups hurt soo much? And how can I overcome it?
0,Why men don’t give other men courtesy in public
0,What is something you should’ve been taught but had to learn on your own?
0,"Guys, what's the male equivalent of yoga pants on women?"
0,Have you ever thought of your daughter in a sexual way?
0,What keeps you going in life
0,What are your thoughts on planning a weekend getaway with someone you’ve been seeing for a week?
0,Any tips on how to navigate a weekend trip with a guy you’re not fully comfortable with yet?
0,"I booked a weekend trip with a guy I’ve been seeing, would it be rude if I accepted his money for half the expenses?"
0,"I booked a hotel room for us for the weekend, should I let him Venmo me for half of it?"
0,"Men who are married or have male family/ friends who are married, what age were you/ them? Looking back What age would you say is best for me to get married? Do you wish you or they got married at the same age, younger or older? Why?"
0,What’s your opinion on booking a weekend getaway trip with someone you’ve been talking to for a week?
0,"I’ve been talking to this guy for a week, is it too soon to go on a weekend getaway trip with him?"
0,How do I keep things interesting and fun on a weekend getaway trip?
0,"I impulsively booked a weekend trip with a guy I’ve been talking to for a week, any tips on what to do if things get boring?"
0,Help! Did I make myself look desperate?
0,Boyfriend lost 1 brother now the other is in the ICU. How can I be there?
0,Have you ever had a partner who couldn't control her child?
0,"If you had to pick a boy band from the 90s that you could tolerate the most, who would listen to and what song?"
0,"Men, do you think your wife/GF is honestly the most beautiful woman in the world?"
0,"People who did realize that you were in fact in love with the idea of love and Dating, how did it affect your dating life/potential or not romance?"
0,What kind of presents would you like to receive from a woman?
0,Should I go after this person? (please help me)
0,"Men, what’s a flirting hint you’d take as ‘oh, she wants to fuck me’"
0,"Male coworker only follows the female coworkers on Instagram, not any of the male coworkers. Why?"
0,"Male colleague only follows the female colleagues on Instagram, not any of male colleagues. Why?"
0,Do men reply to texts just to be polite?
0,https://shrinke.me/tIhrGGr
0,Should I go after this person? (Help me pleasee)
0,Was I wrong to ask bf about condom wrappers in his bed?
0,For all man out there how do you manage daily showers without using shampoo
0,Do you use shampoo daily on your hair ?
0,I need advice on making moves onto a friend
0,"What's the dumbest thing you've heard another man consider ""emasculating?"""
0,What gender stereotypes do you hate the most?
0,"People who attempted suicide, how did your life change?"
0,What would you do as a man if you didn’t have a car but your female date did? How would you get to the date spot?
0,Do you care how much your partner makes?
0,What is the one thing you did not plan for when you got older?
0,Going on a date with a guy but he doesn't have a car but I do
0,"You try open a jar with your hands, but no matter how hard you try it won’t budge. What do you do?"
0,Going on a date with a guy but he doesn’t have a car but I do
0,"Men of reddit, need some advice on long distance potential partner (ex)"
0,"Men who are in long term relationships or have been one, are you still attracted to your woman sexually when she puts on some weight?"
0,Guys who are anti-porn: what keeps you (if anything) from trying to join forces with feminists who are also anti porn?
0,"Pain In Groin, Possible Testicular Torsion?"
0,Whats the longest time you ever tried to get a girl?
0,Guys have you ever gotten your nipple or nipples pierced?
0,How to deal with guilt that you're losing interest in your partner?
0,Which IRL personality is the closest we have for a Batman?
0,How do I get her out of my mind?
0,Can I replace a regular sidewall fire sprinkler with a concealed sidewall fire sprinkler?
0,"Dads of askmen, how did you talk to your sons about masturbating?"
0,What's a weird or rude way someone's hit on you?
0,Can't talk to women. What do I do?
0,"There is a girl that I usually see at the bus station, how do I approach her?"
0,How do I approach a girl that I like?
0,"signs he’s shy, and if so what to do"
0,Do you shave your ass? Why or why not
0,"Men who dated only 1 girl all their life &amp; then married her, how has your experience been?"
0,What do you find the most difficult when dating woman?
0,"If you could ""fix"" something about your partner, what would that be?"
0,"Men, if you ever cheated/almost did it in your first relationship, do you regret it?"
0,He didn’t want me to come over his flat
0,What is happiness to you?
0,I think he (M29) has a girlfriend while dating me (F33)
0,To the guys that have phone holsters - why?
0,Has he (M29) a girlfriend while dating me (F33)?
0,I wanna make you guys feel awesome too.
0,To the guys that have phone holsters for their belt -
0,What's it like working in the trades?
0,husband seems to find my best friend attractive..
0,How will you react if your gf told u that she's doing surrogacy for money?
0,Am I The Asshole?
0,My friend recommended me tablets and now my balls are green. What the hell is this?
0,Would you rather know she is a virgin or not??
0,Ye to hood ka copy h
0,What experience do you have with something bad happening to you but you being oblivious to it?
0,I want to change myself should I start 75 day challenge?
0,How often do you really vibe with a girl? (friendship/romance)
0,Do overweight gay men tittyfuck their boyfriends like men with big tits girlfriend do?
0,Men have you ever realized you actually do have good luck with the ladies as you’ve gotten older as opposed to you thinking you didn’t when you were younger?
0,Should I care when my boyfriend criticize s other people's bodies?
0,A girl said she likes me
0,why do some men ditch their female friends when they get into a relationship?
0,Need Guy’s Perspective
0,What would make you take back your ex? Or retry from the beginning with your ex Partner?
0,what are the go dating apps to use 2023?
0,"Have you been toxic before? And lost people as a result? How do you cope with realizing it, and knowing, the people you lost will always see you with that toxicity?"
0,"I'm 4th generation Irish, Italian, and Filipno. I'm an American mutt. Any other american mutt men out there? How do you respond when someone asks about your heritage?"
0,"she confessed to me and then she ghosted me, what should I do?"
0,"If you prefer toxic women does that mean you are a toxic person, why?"
0,I blocked this guy's phone then everything changed
0,How to get laid in college?
0,Walked out
0,"Are men in relationships who force the girl to dump them by treating her bad cowards or men who care, why?"
0,What little things make you feel special?
0,Men how do you normally breakup with women?
0,"Men have you ever been in a relationship with a girl who you thought was an innocent sweet girl that you had to take care of only to realize you were very very wrong, what happened?"
0,"Women on AskMen, what great qualities of your partner (man) make you feel the luckiest on earth. Brag about your man."
0,What kind of behaviour is this?
0,Men with Neurodivergent Brain. What can a partner do to be supportive ???
0,"I (28M) accidentaly rubbed my privates on some acquaintances (30M, 30M). Should I apologize after the fact?"
0,"What percentage of your income is consumed by debt, and how are you tackling it?"
0,What movie scared the hell out of you?
0,Why would a man not being clear with a woman?
0,"Men, what do you EXACTLY think RIGHTT after Cûmming?"
0,"How do you let go of ideas (if they don't benefit you), and is it easy to you ?"
0,what type of ladies or males do u usually try to date?
0,My male experiences continue to be psychologically traumatizing. How can I find positive male experiences before this turns into a true hatred for men?
0,Tell me how this man thinks
0,Disgust for men
0,what is the best sea salt spray i should get?
0,Wifi Name
0,NEED IDEAS. What are good additions for a “wheel of torture” for a bachelor party?
0,best sea salt spray?
0,Can I become an elite runner like Sara Hall if I don’t have good genetics for running?
0,WIFI NAME
0,Need ideas for “wheel of torture” for bachelor party.
0,Ego dominance insecurities
0,What's your rule of thumb when it comes to sex?
0,How to deal with gf who has a lot of guy friends?
0,Could he be interested? How to test out work acquaintance without ruining reputation?
0,"How much time has to pass before it’s ok to ask your gf about politics and which side she supports, why?"
0,Got caught with a fake I.D trying to enter a casino. How fucked am I?
0,I need 2 more karma
0,"My (25m) gf (28f) and I have been dating for a year and we’re polar opposites, how can I make it work?"
0,Do tattoos make a girl less attractive and if so why?
0,What are your thoughts on the omen with tattoos?
0,"To those who have speech impediment, do you tell people who you interact with often for work, of your speech impediment before hand or do you let them find out eventually?"
0,Do sternum tattoos ruin a nice set of boobs ?!
0,"Fellow Men, what are your thoughts on asking women out that you met while they were working? If you've done it, how'd it go?"
0,"How have you ""dodged a bullet?"""
0,"If a guy asks a girl for her socials despite barely talking to her, does it mean he's interested?"
0,How to show off muscle at work wearing dress shirts?
0,Did hooking up with your ex lead to getting back together?
0,Mental health
0,Men with good money and little time. Have you dabbled in the world of sugar babies and how do you feel about exchanging money for intimacy on a regular basis?
0,Can you love someone &amp; cheat on them?
0,Is it normal for my boyfriend (22M) to be acting this way to his girlfriend (17F)? I may have not voiced out my concerns enough.
0,EOI
0,Expression of Interest
0,How do you prevent precum from leaking through your pants?
0,22/M boner issues
0,"based on your wit, how well do you think you'll be at getting away w murder?"
0,Who’s the most ticklish person in your relationship?
0,Are you comfortable with a man doing your pedicure instead of a woman?
0,"Men who get pedicures, do you care if a guy nail tech does your pedicure instead of woman?"
0,You are now the Scatman! What do you do?
0,How often do you have wet dreams?
0,How do I make the horny go away?
0,Which do u prefer curvy women or skinny women
0,is it possible to balance being kind/funny but respected/taken seriously ? if so how specifically have you done so?
0,"If a girl takes longer route to get back home just to spend couple of extra minutes, could that be a sign that she's into me?"
0,"Guys, is normal to have a obsession with smiles?"
0,What’s your favorite fruit and why?
0,"My friend (19, M) kissed me (21 M)"
0,Why do men ghost when dating?
0,Is normal to have a obsession with the smile of a girl?
0,"I m a Man 22, how did you become more MATURE?"
0,Thoughts?
0,Who more has this obsession for girls with nice smile - teeth?
0,33 M looking for career advice
0,Have you ever dated a woman with daddy issues?
0,what do You find atractive in another human?
