subreddit,title
1,How much do girls care about skin discoloration?
1,New member needing advice! What one tip or truck helped you through the hot flushes in menopause? Please see comments.
1,how did you get rid of your body odour? especially when you're tensed?
1,"I like it but it confuses me. Since February I like a boy, I already felt that he was attracted to me, but I confessed by message and he told me that he was also “interested” but then we kept talking and he left me in seen, is it that he is not really interested? What do you think?"
1,What is a Woman's opinion on erotic fiction?
1,What could go wrong DM-ing the girl I have a crush on?
1,How do you overcome the problem that constantly seeking attentions from men?
1,Why does girls talk about how hot and cool their celebrity crush is to me even if they like me?
1,Do you feel like crap when you talk to your attractive female friends and realize they get special treatment just because they're pretty?
1,What’s the perfect cock size?
1,"An unhappy engaged women in a happy relationship, why!"
1,"Career wise, what's your getting out of the comfort zone story?"
1,"Career women, what's your ""I went out of my comfort zone"" story?"
1,What does sex really feel like?
1,How should I go about this age gap?
1,How do you cope with a sudden breakup?
1,When do men have oral sex when they start dating a woman?
1,"What do you think about ""I can fix him"" relations?"
1,"Hi, who tried the BetterMe app for dancing?"
1,What's the sexiest thing you've ever bought?
1,What should I do with my eyebrows?
1,"Why am i having Constant bloating, pelvic and back pain?"
1,"Why do women tie a man’s access to sex &amp; he can provide together? Aren’t y’all horny too? If so, then why should I provide for something you wanted as well?"
1,"This might be an odd question, but what would y’all recommend wearing to a college graduation? Not as a guest but graduating. I know you usually wear a dress..but what kind? And where is a good place to look for one? Does color matter? Thanks!"
1,MOTHER'S DAY GIFT!!! Don't Give Up Showing Your Mother How Much You Care About Her?
1,What are the clear signs for divorce?
1,why does every woman i date end up having a fucked up fetish
1,What’s a hygiene tip everyone should know about?
1,What’s on your list of baby names?
1,Who uses period cups and can you answer some questions for me?
1,Ladies of Reddit: What are popular women's kinks/fantasies?
1,Stores do not allow people to try on an underwear. How do you get the right size?
1,If men were less horny what would happen?
1,Why are many autistic males often targeted by female covert narcissists?
1,"who here here ""Fake dated"" somebody and one of you caught feelings and now you're dating? What happened did it work out?"
1,Why would a woman attract men who act like they're interested but claim they aren't?
1,How to get around “wearing my sweater” if I’m into tall women?
1,Does anyone know a way i can get my friggin vulva to stop itching like it burns so bad and idk how to make it stop! i havent tried any creams or anything
1,What is the most common reason causing women feel stressed?
1,"What is the most common reason causing women 30 -50- yr old stressed? (For context, I am building a software product that helps women to feel happier, prettier and more confident.)"
1,"My vagina changed colors practically overnight, how can I change it back?"
1,"My vagina changed colors practically overnight, how I can change it back?"
1,How can a fantasy stay just a fantasy?
1,What Gorgeous Glossy Fashion Magazines
1,How did you fell into that affair ?
1,How do you have an orgasm?
1,MOTHER'S DAY GIFT!!! Don't Give Up Showing Your Mother How Much You Care About Her
1,How to overcome internalised misogyny?
1,"When is it considered ""not normal"" to hate your chest?"
1,Basically Separated But He Won’t Leave!! What Would You Do?
1,How do woman keep online dating?
1,What are your best tips for a first date (for a man who is going on a date with a woman)?
1,How should I respond to this? Am I overreacting for not going to my friends wedding anymore bc she unasked me to be a bridesmaid?
1,Why is partner so moody on his cut and arguing so much with me?
1,How can I get out of the friend zone?
1,When women lie about wanting a baby in the future. To get into a long-term relationship. Here’s a high-level account of my traumatic experience.
1,"Women, What Hobby Is an immediate Red Flag?"
1,Why do I (m24) continue to struggle to find a girlfriend?
1,"What BC do you use, if any?"
1,"When women lie about wanting a baby, to get into a long term relationship. Here’s a highly level rundown of my own traumatic experience."
1,How do you know you're talking to an incel?
1,How do you confess your love?
1,I'm a guy and I'm buying new pants for myself. Can I get women's opinion? Which color should I go for?
1,"I feel numb when me and my bf try to have sex, will this go away?"
1,"What do I do, be a single mom or have an abortion? Please help"
1,Religious women of Reddit - what is your favorite verse or quote from your religions holy book?
1,What is the best way to help with cramps?😭
1,Have you been attracted to someone who isn't that attractive for (most of) your (female) friends?
1,How do you go about purchasing your intimate toys: in person or online?
1,What little things do you do to try and improve your appearance?
1,How did you know that you found your soulmate?
1,(Need advice) I’m 18M and I feel like I need to get the message across to my girl best friend (18F) that her bf who she loves has cheated on her before and will do the same again
1,How do you feel about your partner watching porn? Is it considered as being unfaithful?
1,How do I (M) confirm if she is interested in me?
1,Stretch Marks - How to Fade?
1,Who else feels uncomfortable wearing leggings as everyday attire?
1,How do you deal with having broad shoulders?
1,"Did anyone get mild mono? Trying to understand why I’m seeing so many stories indicating it’s serious, since Google says most cases are mild."
1,Where do you purchase clothes from?
1,"Women, what is the best way to make a girl feel comfortable around you? Also, how does one tell if someone has a crush on them?"
1,How important do you value body type when looking for a partner?
1,How do y’all remove hair from your Lower regions without bumps and itchiness?
1,What’s wrong with violating W0men if they can wash their arses?
1,How long does your standard getting ready routine take you?
1,How can I ask my girlfriend to move in with her while I’m in between apartment leases?
1,Do women often google the number of guys who approach them if they have some degree of interest?
1,How often do you and your partner have sex?
1,How Do I get rid of it? Awkward
1,how can i make my waist smaller or hops bigger. 24” waist 32” hips feeling like a rectangle :(
1,Why do men treat some women better than others?
1,First week off birth control - major fatigue - what was your experience coming off the pill?
1,How do you get rid of your upper lip hair?
1,What’s the best way you’ve spent a weekend to alleviate overwhelming work stress?
1,What are good presents for a birthday?
1,What is the minimum salary that you will accept from a romantic partner?
1,Lying and ignoring but I have no clue why. What is the best plan of action when I meet them this week?
1,"""If they wanted to, they would"". To what extent do you agree?"
1,Why do people assume that men that are into transwomen cannot be fully straight?
1,How do you learn to trust again after being raped?
1,Why do girls hype each other up on Instagram?
1,What would be the yes/no for kissing?
1,How do you personally feel about the double standard of fgm vs mgm in regards to united States moral standing? (Last post was old)
1,What to do going to a girls for the first time
1,How do you know a relationship is moving too quickly? (Fear of love bombing)
1,What was it like having a wedding or being a bride? Were you nervous?
1,"Women with Dysmenorrhea, how do you guys manage ?"
1,what is your go to drink when at a party or bar?
1,How often do you wax/ trim your bikini line and why?
1,Why do many women deny the importance of cock size? Why are they afraid to tell the truth? Social pressure? Hypocrisy? Compulsion to conform? Do they want to be nice? Afraid of negative reactions? Other reasons?
1,"How many of you women drink beer? If you do, how often?"
1,Ladies of Reddit: What are your fantasies/kinks?
1,"How did you cope with a partner struggling with addiction, and what advice would you give to others in similar situations?"
1,What does this mean and is it ok
1,How would you describe what usually no spark mean in the relationship?
1,What are some tips to becoming more independent/ confident in yourself?
1,How long should I wait for an application?
1,Suicidal thoughts- how do I get through this?
1,"What’s your standpoint on porn (for, against or don’t care) in a relationship &amp; why?"
1,How would you describe the process of getting your IUD removed?
1,"Women, which type of luxury handbag do u prefer the most?"
1,How would you describe grief to someone who has never experienced it?
1,"Happily married women of Reddit, what qualities do you like most about your spouse?"
1,What changes did you notice coming off hormonal contraception after a long time?
1,What are reasons a woman buys a man clothes?
1,"Women, what is love bombing, and why is that a red flag to you, if one ?"
1,"How do you feel about the recent push for clinical terms for cis women like ""birthing person"""
1,Why are men more sure of their choice of partner?
1,"Women of Reddit, how long did it take after the end of your first serious relationship to feel like yourself again?"
1,How do I fix my living situation?
1,what is soffio.pk ? Please define me the Women is Soffio the best store for clothing can we buy the best and branded dresses here?
1,How do you feel about body shaming the opposite gender?
1,What does anal feel like? Like seriously doesn’t matter if you like it or not what does it feel like? Lol
1,"Ladies, if you suffer with anxiety, how do you deal with it in your dating life?"
1,"Women who have bra cup sizes DD and higher, how does it affect your everyday life?"
1,I cannot be friends with a guy without thinking about being romantically attracted to them even if I am not. how do I deal with this?
1,"Do you think that toxic femininity exists, more so towards other women than men? What defines it?"
1,"Ladies, where is the line between caring for someone and taking care of someone in a relationship?"
1,How important do you think a master's degree is?
1,What's the truth about masturbation? Is it good or bad?
1,How/where to make new close friends/create core group of friends ?
1,"Ladies, what do you use to trim your private area?"
1,How to make new close friends?
1,What is the most annoying thing a guy can do during sex?
1,how valid are criticisms of hookup culture?
1,How to make new close friends
1,What are some things/activities you’d like to do with your significant other during a picnic with just you two?
1,"Women in long-term relationships with partners who travel/are gone often, how do you make it work?"
1,How long do you let your underarm hair grow? Do you trim it or let grow wild?
1,What is the best way your SO has asked for or initiated sex?
1,"Men, what is something that you didn't know about men before you were in a relationship?"
1,what is the best legal way you have sought revenge on someone?
1,Where do you meet up with people from online dating apps?
1,Wife only gets off when thinking about cheating
1,What's the best piece of advice you've ever been given?
1,What are three things that make you smile?
1,what is the best legal way you have sought revenge
1,Why women gain follower so fast on social media ?
1,How do you properly shave your legs?
1,"Women that were using Adidas cotton tech deodorant, before it was discontinued, have you found something similar yet? (what is it)"
1,For the ladies that DO NOT shave their underarms…. how long do you let it grow?
1,"When Motivation for study i am need of a women who can punish me humilate me, degrade me, torture me to tear and throw me back to study table ?"
1,"When Motivation for study i am need of a women who can punish me humilate me, degrade me, torture me to tear and throw me back to study table"
1,what's the best skill you ever got paid to learn?
1,Does anyone know why I rarely get any discharge?
1,What is your definition of love?
1,"Women, what is Intimacy to you?"
1,Who else have experienced irregular period after getting off birth control? Is it normal now?
1,Why do I feel worthless after any family socializing?
1,What is (one)thing you wish you could find out about a man before starting a relationship with him?
1,Boy or girl ??? To whom it may trigger Warning ⚠️ this post won’t have periods or commas
1,What are the best online resources for women self defence?
1,What would your reaction be to your pants not fitting you anymore all of a sudden?
1,When did you realise that YOU were the problem in the relationship &amp; what did you do about it?
1,"how did you convince your doctor to tie your tubes, even though you are under 30 and have had no children?"
1,When did you realise that YOU were the red flag in the relationship &amp; what did you do about it ?🚩
1,What affirmations do you tell yourself everyday?
1,"Women who enjoy going to festivals, what do you wear?"
1,Why do single women reject my advances but women in relationships flirt with me an reciprocate my action? It's really weird and i was hoping you guys had insight
1,Why do single women reject my advances but women in relationships flirt with me an reciprocate my action
1,Should I have sex with my girlfriend even though I know I won’t be 100% hard? What is your mindset on this?
1,Why women are not as impressed with muscles like gay men are ?
1,Who has had a Copycat bestfriend?
1,"Women of reddit, what are your thoughts on 4B movement in south korea?"
1,Where can I find images/arguments about how your partner can’t be all things?
1,What is your “that girl” routine &amp; must have self care products?
1,Where can I find an image about how your romantic partner can’t be all things
1,"when me and my gf spoon, can she feel my down there heartbeat"
1,"Women of reddit, what are some of your sex hacks?"
1,Why Cleavage exposure in public.
1,Where are all the women who like pegging guys
1,Why is there so much pressure on women's looks?
1,"How many are also fully braless, and what challenges or unexpected result have happened, by being braless?"
1,19f and 21m advice needed what do I do
1,"dear women, what can i do about my “strawberry legs” when i shave ???"
1,"Whose wedding l? F(21) is marrying M(25) in may 2025 F family is trying to guilt F into inviting her s partner to the entire day, he is invited to the reception. Both F and M do not like the bf, will make them worry about what he would say and the partner makes them really uncomfortable."
1,"Now that it’s summer weather, what’s your go to outfit/ way not to sweat?"
1,Why are women so fascinated with tall men?
1,What percentage of you women fondle yourselves while sexting?
1,What substances do you take to make sex feel better/increase desire?
1,Sex is so much easier and feels better after a couple of drinks. What do you take to make sex feel better?
1,Why does my significant seem to not want to marry me anymore
1,How would you react if your significant other developed a sickness to fragrances?
1,"Need Suggestions - Ladies, What are some Popular Kinks/Fantasies to explore with my wife?"
1,What is a sign that your man is a keeper?
1,"Women, what is a sign of a keeper in a man?"
1,When a guy who is in a relationship follows you on Instagram does that raise any flags? And what if you don't know him directly but have mutuals on Instagram.
1,Women... how many times do you let your man cheat on you before you leave him?
1,How do you manage to be more rational than emotional?
1,"Ladies, please guide a fellow [22F] comrade who is insecure and unnecessarily jealous?"
1,im caught in such a pickle idk who to speak to but i need help as a bi girl!
1,How do I get over a guy that has a gf :/
1,What are your thoughts on pickup artists/players and is their way of thinking on women and dating right?
1,Would any ladies be willing to explain how I can make something in the bedroom happen with my wife that she has never experienced? I have tried but missing something for it to happen?
1,how do u feel about people that have pronounces on their description?
1,What compliments would be considered too much from a platonic male friend or a guy you're not dating but are close with?
1,Why did hè lieverd about dinner with another woman
1,"Women of Reddit, is it wrong for me (F15) to date my bf (M19)? Who is wrong/irresponsible in this relationship according to y’all?"
1,What are your thoughts on Pick up artist/ player type dudes?
1,What should men be wearing?
1,who had used dossier? is the dupe quality similar to original?
1,When you ever asked a man to meet you in a private place so you could make out?
1,Do women have salary standards when dating a guy?
1,Why are cat guys usually toxic?
1,Who would you prefer as your OB/GYN? A man or a woman?
1,During sexy time why do some women like a finger in their butt?
1,How do y’all raise your kids?
1,How can I train myself not to look at a woman’s chest while talking to her?
1,Why do some women like a finger or thumb in their butt during sexy time
1,What do Woman think of men who enjoy wearing dresses
1,Where are my midsize gals shopping for clothes?
1,I AM VIENY BUT SKINNYY..??? DOES THAT COUNT PLEASE TELL WHICH
1,How (does true love really exsist or is it all just in movies ?
1,What's the appeal for so many young girls in doing dirty porn where they get degraded on camera to these mid 40's men?
1,Why haven't I had my periods for almost 5 months after being fingered for the first time?
1,When did you realize your friends weren't rocking with you like you thought they were?
1,Why haven't I had my periods for almost 5 months after being fingered for the first time
1,Two doctors diagnosed my breast lumps as benign. Who can I trust?
1,What do you think of pubes on guys ?
1,"Ladies, what’s the best first date you’ve been on, and what made it so great?"
1,"For those who don't remove their body hair, why not?"
1,How can you tell if someone is incapable of loving?
1,"Women that have broken up with someone you still love - did you go back and change yourself to stay? Or, how did you move on with this pain?"
1,Who else gets anxiety when spring starts?
1,"Do you think of somebody else while having intimacy with your SO? If so, how does that makes you feel."
1,How would you feel if the person you were dating had emotional problems?
1,How to be a good ally while avoiding confrontation as woman?
1,What shoes do I buy as a gift?
1,"Women who have gotten back with their exes, why? And did you notice a change or did you just settle?"
1,"How often do you shave your legs, and why?"
1,What shoes do I buy as a gift
1,At what point can a man show consistent interest in you and you won’t lose attraction?
1,What triggers imposter syndrome in you?
1,"What would happen if you love someone but losing feelings? What does it mean? Can the opposite also happen, have feelings but no love?"
1,When do you know it’s time to end a relationship? Is there anything that could prevent you from ending it due to your specific reason?
1,What do you think? Is this very unrespectful or I’m being too prude?
1,How do you react when a person tries to greet you by kissing on the cheek?
1,What women think about men
1,Anybody Have Experience with This? (When a significant other/ex significant other exhibits narcissistic/abusive behaviors)
1,How to acknowledge and love your inner child?
1,How to acknowledge and love your inner child
1,Why cant i comment on the self harm scars and new partners post?
1,What’s the best way to wipe to not leave tissue behind in the private area?
1,How coming off hormonal bc after 10 years can affect your feelings towards your partner?
1,What do you wish that males knew about menstruation?
1,How do/did you manage a relationship with different attachment styles?
1,"Women with underactive thyroid (hypothyroidism), how do you manage to grow your hair and keep them healthy?"
1,What is your third place?
1,What's the first thing you notice or look for when you meet someone new off of a dating a app?
1,"Please help me figure this, I dont know what is happening."
1,"Would you date a man without a car? (Also ""why"" because apparently ""would"" isn't a proper w-word to start a question with on this sub)"
1,What's cool about being tall?
1,"what’s your opinion on my situationship , that ended recently very bad?"
1,Why brag about not be texting back?
1,Why do women brag about not texting back?
1,Why am I try permanently damaged?
1,What do women look for in a potential date
1,What are some first date red flags/worst first date experiences?
1,What is the correct shower order? Hair then body or body then hair?
1,Which do you think is more attractive: A man having hair covering his eyes/ a part of his face or his hair away from his eyes?
1,How normal is this for a woman?
1,Need advice that comes from a women who can easily detached?
1,What self care activities have you found most useful?
1,What changes did you see/feel after taking the combined pill?
1,How do you cope with being single?
1,How can I help my significant other during his depressive state?
1,"Not sure if appropriate here, but what is best? to postpone pregnancy due to medical procedure (nothing urgent) or to deal with it later while taking care of baby?"
1,Is pre-pregnancy anxiety normal and how can partner help?
1,What are your nail tech icks?
1,How do you feel about the imminent menopause?
1,What do you think about being asked out in this situation?
1,"Women of reddit, How long would you want your man to last in bed?"
1,What would you do if you put on 40 pounds?
1,Who has recommendations for the best gym wear?
1,What are some regular household items that you feel were made for men?
1,Who here has recommendations for the best gym wear that's not too spenny without showing any camel limbs or that type of accoutrement
1,What are some regular household items that you feel are made for men?
1,"Ladies, how can I (M26) feel sadness without any resistance?"
1,"What states like Boho, Farmhouse, and Rustic are popular? (I am a college student who needs to take a survey for an upcoming test. Helppp :(( ) If you can share your personal experience with the above home styles and why you choose or think so, that'd be great!"
1,"What states like Boho, Farmhouse, and Rustic are popular?"
1,Abuse during sex… just why?
1,How do you cope with not being considered as conventionally attractive?
1,Why does dating apps feel like there’s either frat boys or dudes who are 26 but look 45?
1,Why do girls like frat Boybands like 1D and Hightide?
1,"How do I navigate my bf’s latent sexist preferences, while preferring him to play a traditional role as well?"
1,If I have bad periods how will it effect future pregnancy? Or does it have any correlation. I’m just curious if having a rough period means you will have a rough pregnancy.
1,"What is, in your opinion, a good age for kids to start learning household responsibilities?"
1,"If you got stalked by an ex ,how did you make him stop?"
1,What’s the most attractive color a man can wear?
1,What color is the most attractive on a man in your opinion?
1,What is something new that you learnt after getting into your first romantic relationship ?
1,What’s the most attractive color on a man?
1,My mom wants me to get a job ASAP what should I do?
1,"At-home laser hair removal device, which one do you swear by and love?"
1,My mom wants me to get a job. What should I do?
1,"At-home laser hair removal device, would you recommend one? if so, which?"
1,What is your opinion on people purchasing replicas of designer brands?
1,"When women give choosing signals/IOIs, is it on purpose, or is it subconscious?"
1,How would you feel if your Ex gave you a Taylor Swift Vinyl after one month of break up?
1,Have you ever dated someone thinking you could help or change certain things about them? If so why?
1,Ladies travelling with your period. How do you handle only having white towels in hotel rooms?
1,Need advice on how to deal with creepy ex that won’t leave me alone?
1,Need advice on how to deal with relentless ex that is starting to scare me
1,How can convince my girlfriend to get a nose job without sounding mean ?
1,"ladies of reddit, what are some tips/pointers for a good straightener?"
1,Where's the line between supportive female friendship and a toxic one?
1,Would you consider this a red flag in a man? If it's a red flag why if it isn't why is it a green flag
1,how do you maintain your own routines/habit when moving in with your partner?
1,I won a blowjob by winning minigolf from my date. What is a good target time to last before 💦?
1,"What is love without feelings, and feelings without love?"
1,My girlfriend of 3 years wants me to propose but when's the right time?
1,Why did she do this?Was this flirting or something else?
1,What’s your relationship with your mom like?
1,Dating married guys? How was the experience?
1,Does anyone know what free background check websites I can use for in Canada?
1,"I need some (bad) advice. When a man who is better endowed than my partner asks to see pictures of me on reddit, should I oblige?"
1,Why do women’s underwear fit so much tighter than women’s pants?
1,How do I find a sexually/romantically conservative (not because he can't get any) qt guy besides church?
