subreddit,title
1,Did you augment your handwriting with heart symbols and similar when you were younger?
1,How did you realise that your best friend was fake?
1,"Ladies, do yall think trans women should be allowed on this subreddit? Why or why not"
1,why do i prefer having a bf over friends?
1,Can you manifest things through orgasm and how?
1,Rocking the boat. What do you think?
1,How can I comfort a crying person?
1,What would you do if you discovered your spouse/date has a weird taste in music?
1,What vibe does it gives you when a man wears 1 hoop earring? Do you find it attractive?
1,What is the best way to dispose of used tampons?
1,What are your thoughts on restarting your same life but youre a male?
1,Who Is Wrong in the Argument?
1,How Do you leave the person by you loved..?
1,"Who among these fictional characters would you date - Thomas Shelby from peaky blinders , Jax teller from son's of anarchy or Saul Goodman from Breaking bad and better call Saul?"
1,What do you do when your male partner does not finish? How do you feel or how does he act?
1,How long does it take for you to forgive someone you hated and remember them as a good person?
1,How long does it take for you to forgive someone you hated and remember them as a person
1,found this post. I think this might be a better sub to ask this question. what do y'all think?
1,What can I do with a historically abused partner who warns she might cheat on me because of medication?
1,What should I do about the wrinkles I'm developing at a young age?
1,How long does it usually take you to forgive someone you hate
1,How would you prefer your man to be? Having figured out his problems or be vulnerable to you?
1,"What is that thing, you find very disgusting but men do for fun?"
1,"I have no friends and I’m incredibly lonely, how do i talk to fellow women so i can make any meaningful friendships ? Why do women often not like me ?"
1,I’m a woman and i have absolutely no idea how to talk to women ( crippling loneliness )
1,How do I get rid of a Hemorrhoid?
1,What is the reason for quickly putting your head down when you make eye contact with someone?
1,"Why do women immediately put their head down when I make eye contact with them, while walking in their direction?"
1,Are men really dumb or they play dumb? How do you know?
1,Why Adele looks so much older than Taylor Swift despite the fact that their age gap is only 1-2 year?
1,What help will u suggest to fellow woman
1,Do you get offended when people gift you an item of clothing that is a larger size than what you normally wear?
1,What's your political ideology and how did you get there?
1,what are your subtle signs to signal you are interested in someone romantically?
1,What are your subtle signs to signal you are interested in someone?
1,"I hate the way that I am, what’s wrong with me?"
1,What is your favorite chess opening?
1,"My neighbor has been playing the song “Joey” by Concrete Blonds, on repeat for about an hour. When should I go check on her?"
1,What do you guys do for BAAAD period cramps? The ones that make you scream bloody murder 😭
1,Am I (24F) being immature when considering what I want in a long-term partner?
1,who else is not good at a single thing?
1,how to Get Free 500$ coupon from google ads
1,Who else has found out their man uses Grindr?
1,I've seen my ex-gf lurking near my home with her best friend. Not once. Is it some sort of sign which she's trying pass?
1,what have you learned from the death of a loved one?
1,IUD question for those who have/had one?
1,IUD question for those who have/had one.
1,How did you realise someone was projecting onto you?
1,"Women who chose to be stay at home moms, how is it going? How has your experience been so far?"
1,Does it creep you out when men are too desperate for a relationship?
1,How did you get over your first heartbreak?
1,"Ladies, what were your worst side effects whilst taking the contraceptive pill?"
1,How do I approach the topic of low-sex drive/experience coming up to my 30s
1,"ladies, what would u consider a genuine female friendship?"
1,How to Win 3 months subscribtion Allure Beauty Box
1,What advice would you give a really unsttractive shy man to
1,What is a good perfume to buy for my fiancés (f28) birthday coming up soon?
1,"Have you ever thought of how, when and where would u want to die?"
1,What's your opinion on Johar culture (please read the body text if you want the meaning of the word)?
1,"What happened in your relation, (family, job relation, partner etc) with a psychopath?"
1,Women of Reddit: Do you care where a man finishes or would you prefer he asks you where you want him to finish?
1,"Why my (F35) (M27) ""situationship"" went sour?"
1,Am I the only guy who doesn’t like dating women that like other women?
1,Where do you guys put your purse when driving?
1,Why is that tall muscular men have better luck with approaching and dating girls?
1,What should I do? I missed a week + on combination pill! Help!
1,What is a really nice perfume for a birthday?
1,What perfume to buy for a birthday
1,What is something you should’ve been taught but had to figure out on your own?
1,"Ladies, how can I make my proposal unforgettable?"
1,What advice would you give on a proposal?
1,How do you see a guy if he opens up about his sexual insecurities?
1,What's something you wish you were more knowledgeable in to appear more attractive to men?
1,Why do women dance when they get food
1,How did he propose? Good and bad answers.
1,"I’m 36, although I have a pretty face, I am a chunky momma! People always comment that I could be prettier if I was thinner. And it doesn’t help that I always see my H looking at other girls. It makes me more insecure. How can I be more confident?"
1,Why do women date other men when they already have someone serious about?
1,Why do so many seem to say one thing and act in a completely opposite way?
1,How long was your longest relationship and why did it end?
1,Why do people probably boast about their lack of cooking skills?
1,What's your favorite romance book?
1,Ladies with nipple piercings who don’t wear bras - do you like it when people look at the piercing? I want one and will enjoy the attention but want to get a broader sense from you all.
1,When is Love just not enough?
1,I can‘t get over how awkward I feel during sex
1,How to know if it's Just a compliment or flirting?
1,"Ladies, how often do you text/call your parents?"
1,"Ladies, how often do you talk to your parents?"
1,How to get confident flirting with guys when you’re shy? Any tips or tricks?
1,"Have you ever dated a""nice guy""? What happened?"
1,"Have you ever dated a ""nice guy""? What happened?"
1,"Have you ever dated a""nice guy"" or an incel? What happened?"
1,"Have you ever dated an ""nice guy"" or an incel? and how did it go?"
1,"If the guy lives with his parents, would you date him?Why?"
1,What is your opinion on men who can bake?
1,What to do about my friend’s subtle jealousy?
1,"Women in relationships who deal with insecurity and anxiety/jealousy, what do you do to get rid of the feelings?"
1,Ladies what is the most important thing you expect in a relationship
1,What analogy would you use to describe sex with and without a condom?
1,Why do some women love to see a man masturbate?
1,Do women truly love men or you love what they can provide to you?
1,"Women Who Went to Law School, were you a part of your Women's Law Organization?"
1,What advice would you give to a teenage girl?
1,What should I say while Mentoring teenage family friend
1,How do I get over a situationship??
1,Why does my wife masterbate secretly before we have sex?
1,Ladies who thought they found 'the one' when did you realize he wasn't?
1,What are some gestures that can help me win back my GF?
1,"Would You Date a Transgender Man (If You're Straight)? If Not, Why?"
1,At what age did you move out of your family home and on what salary?
1,who is being weird in this scenario?
1,M25 - My short experience with dating and why I fear future me. Please help ?
1,Need help - M25 - My short experience with dating and why I fear future me
1,I hate my skin for having a scars which i can't wear dress or short due to visible scars from motor cycle accident
1,"What is your dream date, something that seems very romantic to you??"
1,"Ladies, what are some red flags you purposely ignored in the beginning thinking it would get better overtime?"
1,Why do I feel finically insecure?
1,M25 - My short experience with dating and why I fear future me
1,"What are men generally expected to bring to the proverbial ""table""?(Relationship)"
1,What are your thoughts. Would it be wrong to wear my brides maids dress for other events before the intended wedding?
1,"""How to be respectful towards Man?"""
1,Is it normal for my fiancée give her underwear and take mine? Why was she excited for this?
1,How do I comfort my mom after she lost her mother?
1,"What do you think about brown guys on the internet? If anything, why?"
1,How to clean with food from your house!
1,what are some of your favorite self-care practices?
1,What do you imagine when chatting with a male stranger?
1,What’s happening to me? Can you help me?
1,When is the right time for women to have children?
1,Why is the “I” in “I love you” important to you?
1,Do you want the person you find attractive to come and talk to you? If so how?
1,"Women who are daughters to working mum/parents, did you ever feel neglected growing up, or craved for more time and affection with them, and do share your experiences?"
1,"Women who are gastric or colorectal cancer survivors, what symptoms made you feel you should go to GI?"
1,"Women who got their nose pierced, how did you get rid of that annoying nose bump after it?"
1,"Women, do you want the person you find attractive to come talk to you? If so, how?"
1,How do women feel about virgins?
1,How to deal with menstrual pains and what are your remedies? More details in caption.
1,Having difficulty with a female friend. What's you understanding of my situation?
1,Women of Reddit Do you think “bad” women are partly the reason why a lot men have a negative view point on women when it comes to dating and relationships ?
1,What do you think?is it possible for a guy to convince a girl to be in a relationship?
1,How will AI impact online sw in the near future?
1,How do you deal with doubts after breaking up with someone?
1,What's your take on Dating a Guy with Lazy Eye
1,When a former best friend tries to come back.
1,"Women who went to school to study medicine after age 35, how did it go?"
1,Why are men‘s hygiene articles much cheaper and better?
1,"In your opinion, is it normal for men to cheat when in a relationship?"
1,Just found out my(f25) bff (f25) thinks I’ve been crushing on her fiancé for years… what do I do?
1,I (18F) was involved in an uncomfy sexual experience. What should I do?
1,I (18F) had a drunken hookup with a now ex-friend (22M) and I don't know what to do about it
1,"Ladies, what fragrance do you find attractive for (young adult) men?"
1,When My Dad Forgot My Name
1,How did therapy help you?
1,"For the women with mental illnesses (and not only), in what ways did therapy help you?"
1,"Ladies, how do you stop loving someone?"
1,"Elder daughters of Reddit, how do you maintain a balance between catering to your emotional and financial well-being &amp; caring for and pampering your family?"
1,What's your weirdest guilty pleasure?
1,How do you deal with men who approach you in public?
1,Who: F(24) assaulted by a man (m30) where ; in a club. Who: I am unsure if I should seek compensation for the mental damage?
1,Who (f25) assaulted by a man (m30) seeking compensation
1,what is your opinion about incest as kink/fetish ?
1,Why do girls cry when they get caught cheating but not bc of the guilt?
1,Do women care about being with a guy who is/has a lot more ( sexual ) experience
1,How would you cancel a date?
1,What should I do? I'm at a point where I don't know anymore.
1,"I'm 21 and still single with no experience of love/dating. HOW can I start my love part ,Any suggestions???"
1,"Dear women of reddit, how does protesting nakedly and vagina revolution help to empower women?"
1,What is your opinion on sex during your period?
1,Your Bsf cheated on their bf when they were 19 and they are still together. Would you tell the bf?
1,"ladies, why do y'all apologize so much?"
1,How judgemental do you think you are?
1,What’s one thing you wish men would stop assuming about women?
1,Change from normal pill to gestagen pill totally messed up my cycle. Who has/d the same issue?
1,What advice you would give to women in their 20s?
1,How would you feel if your SO attended a gym where some women wear sports bras and booty shorts?
1,How was your first crush experience?
1,How many of you actually keep your ass clean enough to be eaten out.
1,"Hello beautiful ladies, how do you stay safe when travelling alone?"
1,What do I do about this guy at work!? I need advice!
1,"how does it make you feel when you see a man have a tattoo of a woman, whether it's sexual, fan art of a celebrity, or more artsy?"
1,"What behaviors do you observe from friends that frustrate you, but you feel do not warrant a discussion or confrontation?"
1,"At-home hair removal; Epilators vs Waxing etc., which methods have you had success with?"
1,What is your current hyperfixation?
1,"Who (f25), Should I ask my abuser for money? (M30)"
1,What's the most random subreddit you're in?
1,Anyone who has an anxious attachment style been in a relationship with someone with ADHD?
1,Is it bad to message a girl too fast when first getting to know her?
1,Anyone who has an anxious attachment style been in a relationship with with a man with ADHD (inattentive)
1,"Women who created an Onlyfans account for explicit content, didn't succeed, and left: Did it affect your life in any fashion after leaving?"
1,What would your partner have to do to make you fall out of love with them?
1,What do i do? My(19) sister(21) is my roommate and i’m going crazy
1,Why is my period is 11 Days late?
1,How to stop being anxious?
1,Genuine question to those who's lost their partners to the other side
1,What caused you to become fiercely independent?
1,What is it like to date someone who is older and has a young child from a pervious relationship?
1,Casual Convo Fridays
1,Would you say “hi” back to people who backstabbed you or would you flat out ignore them?
1,Who realised that their partner 'wasnt the one' but continued to stay with them? Did it work out in the end?
1,What is your approach to confronting emotionally charged situations?
1,What do you do to empower yourself and raise your self-esteem?
1,Where can I find beginner/intro level erotica books/audio-books to recommend to my wife to help her develop more of her sexual imagination &amp; be able to become more descriptive when dirty talking?
1,How can I give a girl princess treatment if I don’t make that much?
1,How to Cover/Hide Stretch Marks
1,Did you get into relationship with a guy who had a crush on you for years while you were apart? How it turned out?
1,what should i do with my feelings towards my best friend
1,When you confused lust with love?
1,Why is birth control considered bad for you?
1,I got used and it hurts a lot more than it should. Why?
1,Am with a woman who won't get divorced
1,Why do I feel insecure showing my legs having a larger chest?
1,"What was something you really wanted to buy but when you got it, it wasn't satisfying at all?"
1,How can I grow shorter over summer?
1,As a 6'4 slightly autistic guy what things should I do to make sure I don't freak out women
1,What are signs a woman is finally ready to leave?
1,How do i overcome sexual jealousy and insecurity regarding partner (F 26) sleeping with someone on a break?
1,What’s your favorite weekend ritual?
1,What activity or hobby is your release?
1,"Ladies, what’s the “pettiest” thing you did after a breakup?"
1,"Ladies, what’s the most disheartening thing a guy did when he didn’t find you attractive?"
1,How do you feel about being approached in person?
1,How would you describe this dress?
1,"Ladies, how has not having romantic relationships in school, affect your adult life?"
1,"To those who have been involved in a ""love triangle,"" how did it go?"
1,"If were to experience only one type of pain for the rest of your life, which one would you prefer: emotional pain or physical pain?"
1,"Ladies, have you ever went through your partner phone, how did it go?"
1,"Ladies, what gut feeling have you ignored?"
1,"Ladies, have you ignored your gut and regretted? If so, what happened?"
1,What your cutoff age for not having been in a relationship before?
1,To all the women who had/have IUDs?
1,Why is moving so emotional?
1,What is the fastest way you've seen someone fuck up their life?
1,To all the women who had/have IUDs
1,Is there any workplace issues that you face as a woman and wish it changes? If yes what are they?
1,When should I ask this girl out?
1,Why is this Girl taking a long time to snap me back
1,As a woman what turns you on mostly
1,How do you get used to being the DUFF?
1,How do you establish standards or dealbreakers when finding the right partner?
1,What is something you struggle with?
1,"Women who have had the opposite gender as doctors, therapists, etc, how well did it go for you?"
1,If you were dating a man and he started to go bald would you continue to date him? Why? Why not?
1,What are you struggling with right now?
1,Have you ever stopped dating a man because he was starting to go bald? Why?
1,Women with a real resting-bitch-face.. what is that like?
1,What was life like for you in your late 20s?
1,What are some good practices of making a long distance marriage work?
1,What items do you always keep in your purse?
1,What items do you always have to carry in your purse?
1,Does age matter in Relationship what is your opinion?
1,How to make friends and live alone again?
1,Why do women wait until after the date to text that they were horny.
1,How would someone M(18) go about talking to a friend F(19) that they have talked to in a couple years?
1,What question can a guy ask you to guage your interest in being his girlfriend without directly asking it flat out?
1,What’s the best way to get rid of knuckle hair?
1,What would you want your partner to say to you after an unexpected pregnancy?
1,"If someone asked you what do you bring to the table in a relationship, what would be your answer?"
1,How to overcome IUD anxiety/trauma?
1,How did Yasmin affect your mood in the early days? Am I going mad?
1,What`s your comfort food during your period?
1,"When making love to your SO, would you consider it cheating if they were fantasing about someone else?"
1,"Women who are new to motherhood and have toxic family, do you keep them in the picture?"
1,What should i do? Orgasm related question.
1,"If you do, what type of music do you like to listen to while you’re working or studying?"
1,Whom do you put makeup 💄 on for?
1,"A guy you've never met comes up and offers you money to sleep with him, what would the amount have to be for you to say yes?"
1,What’s the advice here? With regards to dating
1,What are some songs that make you feel empowered as a feminist?
1,"Hello, my wife has been on birth control for about 4-5 years now. Early on she had bad nausea because of it but eventually found one that worked. Until recently every other month or two she will get nausea on the first few pills of the week but this week has been really bad .....not sure what to do"
1,Women of Reddit what things have modern man said to you or on social when it comes to relationships that have pissed you off ?
1,Help! Period not here but not pregnant? Who can help
1,Why does it seem like some women like being disrespected?
1,What would you think and do if a person you really loved finally told you that they loved you but then the next day told you they didn’t actually mean it?
1,What would you do if a person you really loved finally told you that they loved you but then the next day told you they didn’t actually mean it?
1,What professional athlete are you physically attracted to?
1,After how long did your partner feel like 'home?'
1,"How seriously do you take the words, “I love you,” from someone you are dating, why?"
1,"Ok, cliche question. Why wear short clothes when it's cold out?"
1,What is a go to movie to get a good cry out?
1,"Ladies, how do you feel about about adults wearing Disney attire with characters on them when they are not at a Disney theme park?"
1,What form of grooming do you wish more men took part in
1,"Black women, what hairstyle do you do when you are tired of dealing with your natural hair?"
1,Is it a red flag when you meet a potential partner with a high body count and no real long term relationships?
1,How did you change after having your first relationship?
1,I gave up on dating What can I do to improve?
1,how do You feel with your body?
1,What does one do when your SO isn’t intimate or affectionate (because they didn’t grow up with it) but it’s what you need?
1,What guy name is usually a red flag?
1,What would you buy (or create) to quell anxiousness?
1,When dating is it better to keep the past in the past or share? [26f] [26m]
1,How to become friends again with the friend I confessed my feelings to ?
1,How old are you and how many exes do you have? (do you exclude some relationships?)
1,"How do I tell my girlfriend of six days, that we're going to fast?"
1,What questions do I ask my birth mom to help me get to know her?
1,Why is my (29F) partner (28M) always apologizing.
1,Women who didn't want kids. How is your life now?
1,What are some good gift ideas for Mother’s Day?
1,"Imagine you go back when you were 17/18 in College, what are the things you would like to change/add which could make your current life better ?"
1,Why did my (M31) ex-fiance (F28) care so much about a rumor I was bi?
1,"Who cheats more, men or women?"
1,Who has had lower right abdominal pain caused by gas?
1,"Girls, what's your opinion on men owning pocket pussies?"
1,"Tinder guy cancelled for the second time, what do I do?"
1,Would you date a guy who struggles with social anxiety? Is this a major turn-off or deal breaker and why?
1,"Single ladies, what makes you “undateable”?"
1,Single people: What makes you undateable?
1,"Question for conventionally attractive women, how does your life feels, do you get any benefits from your looks?"
1,What Is A Good Gift For Wife After The Birth Of First Child? Do Women Expect Gifts From Their Husbands After A Child Is Born?
1,What is the big deal about not using Facetime and using alternatives?
1,How to understand an old friend as best as possible
1,Who thinks women stereotyping still exists?
1,Are there actually any women who like overweight men or am I just doomed to loneliness?
1,How to you ween you child of the booby
1,"I think I encountered a trafficking attempt, and can't make sense of it. What happened?"
1,Has any other women experienced this kind of thing ? What’s the deal?
1,How do you get over someone?
1,What to do? Hit on by guys 40+ at work
1,Ladies that were on the fence about breaking up or staying with your SO. What was the deciding factor?
1,what kinds of chatting sites do you know?
1,what kind's of talking chat sites do any of you know
1,"How often do men hit on you/give you the ""look"" when you're at a bar?"
1,"Women of Reddit. Can someone help me gauge this scenario with a crush of mine, and why she may have acted this way?"
1,What are the effects of quitting hormonal BC? The good and the bad.
1,"how to do you start dressing like an adult once in your 20s? where do you find clothes, what do you start with? what’s worth spending money on and what’s not?"
1,How do you know if he is just playing with you?
1,What do guys do that gets you in the mood?
1,How to tell if I had an orgasm
1,Who else would be bothered by this or am I over reacting?
1,Need advice on how to deal with partner’s silent treatment and aggressive behavior?
1,Why don’t men ask me out? Do we have to ask the dude out ourselves?
1,What book should I read next?
1,Let's talk about hugs! What kind of a hugger are you with your friends and which ones do you prefer yourself?
1,What is a high that you are still chasing?
1,What rituals/traditions do you have with your SO
1,What is the one thing you really hope is no longer around ten years from now?
1,"how do you do women of reddit, Is it possible to be sexist towards a man?"
1,Let's talk about hugs! What kind of a hugger are you with your friends?
1,How do you know or can tell you’re being used by girl?
1,How important is it for you that your man has a six-pack?
1,What is your take on the way certain women act on TikTok/social media?
1,How many UTIs a year do you experience?
1,How to have a good relationship with food and money?
1,What perfume to buy for fiancés birthday?
1,Need advice on how to help my partner to talk about feelings instead of giving silent treatment or getting aggressive on small issues
1,What perfume for a Birthday gift
1,How many close/best friends do you have?
1,"Women going through cancer, at what age did you get diagnosed? What was your partner's response?"
1,I have strange feelings for the girl who has a crush on my bf.
1,How/does a man having foreskin affect sex?
1,What do you guys use for period cramps?
1,"Women, do you like when guys taste their own cum?"
1,"Those of you with business degrees, how have you utilized it?"
1,"Women, I’m arguing with a friend, are stretch marks on men hot / what do you think of them?"
1,what are reasons except pregnancy and PCOS for not getting periods?
1,Who From Your Past Do You Really Wish You'd Stayed In Contact With?
1,Need advice on how to how to help my partner who gets triggered on small things
1,What is an opinion you have that would be considered unpopular by other women?
